identifier,jcr_title,jcr_description,sizes,price,summary,features142965,Amsterdam,Short-Sleeve Shirt,"XS,S,M,L,XL,XXL",39,"The Amsterdam travel shirt features a soft, breathable fabric blend that keeps you comfortable on city adventures.","Cotton/polyester/spandex blend wicks moisture and has a soft handFabric has a touch of stretch to ease movementsButton placket lets you adjust the ventilationClassic fit that follows body contours without being tight"130482,Modern Relaxed,Jean,"26,28,30,32,34,36,38,40",98,The Modern Relaxed Jean is looser through the hip and thigh and topped off with a slightly longer rise and button fly. It's kept modern by slimming and tapering the leg.,Approx. buckle dimensions: 2 1/4157915,Sonja,Insulated Jacket ,"XS,S,M,L,XL",189,"Warm and waterproof mountain performance is enhanced with stylish accents like faux fur trim, for wear both on the mountain and après-ski.","Water and stain-resistantLightweight primaloft insulation is quick drying, insulates when wetImported.Machine wash and dry."